<?xml version="1.0" encoding="utf-8"?>
<managers xmlns="https://www.w3schools.com"
          xmlns:xsi="http://www.w3.org/2001/XMLSchema-instance"
          xsi:schemaLocation="https://www.w3schools.com managers.xsd">

    <manager>
        <managerID>1</managerID>
        <username>Ilyass_ouahabi</username>
        <firstName>Ilyass</firstName>
        <lastName>Ouahabi</lastName>
        <email>Ilyass.wahabi@gmail.com</email>
        <password>Admin123</password>
        <phone>0652856545</phone>
        <img src="/res/image.jpeg"/>
    </manager>


</managers>